{"v":"hscf-1","kind":"hubspot_schema_pack","profile":"full","m":{"ot":"0-1","id":"1","fqn":"CONTACT","name":"contacts","mt":"HUBSPOT","labels":["Contact","Contacts"],"desc":"Synthetic contact schema for HSCF tests.","req":["email"],"search":["firstname","lastname","email"],"pd":"email","sd":["firstname","lastname"],"sensitive":true,"archived":false,"restorable":true,"createdAt":"1970-01-01T00:00:00Z","updatedAt":"2026-01-01T00:00:00Z","createdByUserId":null,"updatedByUserId":null},"d":{"t":["string","enumeration"],"ft":["text","select"],"g":["contactinformation","analytics"],"ds":["non_sensitive"]},"pk":["n","l","t","ft","g","desc","ds","eo","f","mm","hints","x"],"p":[["email","Email",0,0,0,"Contact email address.",0,null,104,[true,true,false],null,{"displayOrder":0}],["firstname","First name",0,0,0,"First name.",0,null,96,[true,true,false],null,{"displayOrder":1}],["lifecyclestage","Lifecycle stage",1,1,0,"Example small enum.",0,"lifecyclestage",64,[true,false,false],null,{"displayOrder":2}],["example_region","Example region",1,1,0,"Example large enum that should become a sidecar.",0,"example_region",64,[true,false,false],null,{"displayOrder":3,"futureHubSpotKey":"preserve me"}],["hs_calculated_example","Calculated example",0,0,1,"Synthetic read-only calculated property.",0,null,49,[true,true,true,true],null,{"displayOrder":4}]],"ek":["l","v","d","o","h","x"],"e":{"lifecyclestage":{"v":"hscf-1","kind":"hscf_option_set","object":"synthetic_contact","property":"lifecyclestage","ek":["l","v","d","o","h","x"],"o":[["Subscriber","subscriber","",0,false],["Lead","lead","",1,false],["Customer","customer","",2,false]],"raw":{"sourceHash":"sha256:c4293ec3902d77650a3e06b25302b495c8ae9168ab8bb362df449f252f2affab"}},"example_region":{"ref":"options/synthetic_contact.example_region.hsp-options.json","count":26,"hash":"sha256:d627fe2210e5f58f67793c0b0df5285adb014ca7b6c46caaa293cf05cec731b3"}},"ak":["from","to","name","card","inv","maxTo","maxFrom","id","f","x"],"a":[["0-1","0-2","contact_to_company","ONE_TO_MANY","ONE_TO_MANY",1,500000,"1",null,{"createdAt":null,"updatedAt":null}]],"idx":{"prop":{"email":0,"firstname":1,"lifecyclestage":2,"example_region":3,"hs_calculated_example":4}},"refs":{"view":"synthetic_contact.hsp-view.json","props":"parts/synthetic_contact.hsp-props.json","optionsDir":"options/"},"x":{"top":null,"sourceMeta":{"ok":true,"source":"hubspot","portal":"example","command":"schemas.get","object":"contacts"}},"wk":["sev","code","path","msg"],"w":[["w","UNKNOWN_PROPERTY_KEY","$.properties[3]","Preserved in property x"],["i","OPTION_SET_SIDECAR_WRITTEN","$.properties[3].options","26 options"]],"raw":{"sourceHash":"sha256:97c68d17f5ddc6647b8edea70ab34d86a0f8dba39297c234e83693fffb960c99","encodedAt":"2026-06-02T16:02:40Z"}}
