{"v":"hscf-1","kind":"hubspot_schema_pack","profile":"view","m":{"ot":"0-1","id":"1","fqn":"CONTACT","name":"contacts","mt":"HUBSPOT","labels":["Contact","Contacts"],"desc":"Synthetic contact schema for HSCF tests.","req":["email"],"search":["firstname","lastname","email"],"pd":"email","sd":["firstname","lastname"],"sensitive":true,"archived":false,"restorable":true,"createdAt":"1970-01-01T00:00:00Z","updatedAt":"2026-01-01T00:00:00Z"},"pk":["n","l","t","ft","g","desc","ds","eo","f","mm","hints","x"],"idx":{"prop":{"email":0,"firstname":1,"lifecyclestage":2,"example_region":3,"hs_calculated_example":4}},"refs":{"full":"synthetic_contact.hsp.json","props":"parts/synthetic_contact.hsp-props.json","optionsDir":"options/"},"raw":{"sourceHash":"sha256:97c68d17f5ddc6647b8edea70ab34d86a0f8dba39297c234e83693fffb960c99"}}
